{
  "version": "1.0",
  "name": "示例请假流程",
  "nodes": [
    { "id": "start_1", "type": "start", "position": { "x": 40, "y": 160 }, "data": { "label": "开始" } },
    { "id": "task_1", "type": "task", "position": { "x": 240, "y": 140 }, "data": { "label": "填写申请", "description": "提交请假信息" } },
    { "id": "cond_1", "type": "condition", "position": { "x": 500, "y": 140 }, "data": { "label": "是否超过 3 天", "expression": "{{ task_1.result }}" } },
    { "id": "end_1", "type": "end", "position": { "x": 780, "y": 80 }, "data": { "label": "结束" } },
    { "id": "end_2", "type": "end", "position": { "x": 780, "y": 240 }, "data": { "label": "驳回结束" } }
  ],
  "edges": [
    { "id": "e1", "source": "start_1", "target": "task_1", "sourceHandle": "source", "targetHandle": "target" },
    { "id": "e2", "source": "task_1", "target": "cond_1", "sourceHandle": "source", "targetHandle": "target" },
    { "id": "e3", "source": "cond_1", "target": "end_1", "sourceHandle": "true", "targetHandle": "target", "label": "是" },
    { "id": "e4", "source": "cond_1", "target": "end_2", "sourceHandle": "false", "targetHandle": "target", "label": "否" }
  ]
}
